DRN-3859221,Mr W,Barclays Bank UK PLC (Barclays),Banking,Barclays sent him a text alert with the wrong balance.,Text alerts service,"['text alert', 'wrong balance', 'network issue']","['inaccurate text message', 'network delay', 'refund request']",755,26 June 2022,do not uphold,Martin Lord,1 February 2023,Incorrect balance shown in text alert,He was concerned that money had been taken from his account fraudulently and this stress ruined his holiday.,Refund the difference of £755.,"Mr. W received a text alert from Barclays showing an incorrect balance of £12,689.35 on 26th June 2022. He had previously received a text on 23rd June showing a balance of £13,444.15. Barclays stated that they did not send a text on 26th June and that the text received was likely delayed or re-sent by Mr. W's mobile network provider.","The Ombudsman found that Barclays did not send a text message to Mr. W on 26th June 2022 and that the text received was likely a delayed or re-sent message from 9th June 2022 due to a network issue. Therefore, the Ombudsman did not uphold Mr. W's complaint."
DRN-3861970,Mrs C and Miss C,Barclays Bank UK Plc,Banking,Barclays Bank UK Plc refuses to refund the money they lost to an investment scam.,Current account,"Investment scam, prevention, recovery","Payments, communication, liability",59050,,Dont uphold,Dolores Njemanze,13 March 2023,Investment scam,Barclays failed to prevent or recover the scam payments,Compensation for the stress and inconvenience caused by Barclays,"Mrs C and Miss C made payments from their Barclays account to an investment company called K, which turned out to be a scam. They reported the scam to Barclays, but Barclays did not refund the money. They complained to the Financial Ombudsman Service.",The Ombudsman found that Barclays was not liable for the scam payments because Miss C authorised the payments and there were no red flags that would have caused Barclays to suspect fraud. The Ombudsman also found that Barclays did not unreasonably hinder the recovery of the funds.
DRN-3873869,Mr C,Barclays Bank UK PLC,Banking,Barclays Bank UK PLC didn't take sufficient actions when his account was taken over and told him to stop the sale of a property leading to financial problems.,Bank account,"Account takeover, financial loss, poor service","Account security, customer service, financial hardship",,,Do not uphold,Michael Crewe,7 February 2023,The complaint relates to Mr. C's dissatisfaction with Barclays Bank UK PLC's handling of his account takeover concerns and the subsequent financial problems he faced.,"Mr. C alleges that Barclays failed to take appropriate actions to protect his accounts, resulting in financial difficulties, homelessness, and inability to run his business.",Mr. C seeks compensation for the financial losses incurred and wants to be taken seriously regarding his concerns about fraud and poor service.,"Mr. C reported unauthorized access to his accounts at Barclays and other financial institutions. He claims that branch staff advised him not to receive funds from a property sale and not to sell the property, leading to financial problems. Barclays denies these claims and states that it took steps to protect his accounts. The Ombudsman's investigation did not find sufficient evidence to support Mr. C's allegations.","The Ombudsman considered the available evidence and concluded that it was unlikely that Barclays staff would advise Mr. C not to sell his property. The Ombudsman also noted that Mr. C did not provide specific details of unauthorized transactions or cooperate fully with the investigation. While acknowledging Mr. C's financial difficulties, the Ombudsman found no direct link between Barclays' actions and the losses incurred."
DRN-3881811,Mr C,Barclays Bank UK PLC,Financial services,Barclays increased his monthly mortgage payment to an amount he couldn't afford and misled him about the reason for the increase.,Mortgage,"mortgage payment increase, incorrect information, arrears","affordability, communication, financial difficulty",,,dont uphold,Jeff Parrington,22 February 2023,"Incorrect information provided by Barclays about the reason for the increase in his monthly mortgage payment, leading to arrears on the mortgage.",Mr. C believes that the arrears on his mortgage are Barclays' fault and should be waived due to the incorrect information provided by the bank.,Mr. C wants the arrears on his mortgage to be waived and his credit profile to be restored.,"Mr. C had an interest-only mortgage with Barclays and agreed to a fixed-rate deal that ended in January 2021. Barclays sent him letters informing him that his mortgage would revert to a tracker rate and provided information on how to arrange a new deal. However, in a phone call in March 2021, a Barclays representative gave Mr. C incorrect information about the reason for the increase in his monthly payment. Mr. C continued to pay his old monthly amount, resulting in arrears on the mortgage. Despite his attempts to resolve the issue, he was unable to obtain a new interest rate deal due to the arrears.","The Ombudsman acknowledged that Barclays provided incorrect information in the March 2021 phone call, but emphasized that Mr. C had been previously informed in writing about the upcoming changes to his mortgage. The Ombudsman found that Mr. C's failure to take action to arrange a new interest rate deal contributed to the arrears and that there was not an unbroken chain of causation between the incorrect information and the arrears. Therefore, the complaint was not upheld."
DRN-3893430,"The trustees of a trust, which I'll refer to as L",Barclays Bank UK PLC,Banking,Barclays Bank UK PLC closing L's account without notice and the time taken to sort things out.,Bank account,"Account closure, inconvenience, compensation","Banking services, customer service, financial loss",,,uphold,Andy Wright,6 March 2023,Barclays Bank UK PLC closing L's account without notice and the time taken to sort things out.,"The trustees of L said that, to resolve matters for both L and M, they had spent 10 to 15 hours of their own time and incurred substantial fees from the trusts professional advisers.","The trustees of L said it had taken them and their accountants, land agent and solicitors a substantial amount of time and effort to resolve matters, including arranging alternative payment methods to their creditors.","Barclays Bank UK PLC closed four accounts held under the personal record of an individual who had died in 2003. The accounts should have been closed at the time and the funds transferred to two trusts: L and M. However, the accounts had erroneously remained open and continued to be operational. The trustees of L and M became aware of Barclays actions in August 2021 when a VAT cheque was returned unpaid.","The Ombudsman considered that Barclays should have identified the situation earlier, but that the trustees of L would have likely had to provide the same documentation at some point in time. The Ombudsman also considered that the trustees of L chose to appoint professional advisers to support them, which was their choice. The Ombudsman concluded that the amount of compensation sought by the trustees of L would not be fair or reasonable, but that Barclays offer of £300 should be increased to £450."
DRN-3893442,"The trustees of a trust, which I'll refer to as M",Barclays Bank UK PLC,Banking,Barclays Bank UK PLC closed Ms account without notice and the time taken to sort things out.,Bank account,"Account closure, Lack of communication, Inconvenience","Banking services, Customer service, Financial loss",,,uphold,Andy Wright,6 March 2023,Barclays Bank UK PLC closed Ms account without notice and the time taken to sort things out.,The trustees of M were inconvenienced as they had to source and provide documents to Barclays and make suitable arrangements with Ms creditors.,Compensation for the inconvenience caused.,Barclays Bank UK PLC closed Ms account without notice and the time taken to sort things out. The trustees of M were inconvenienced as they had to source and provide documents to Barclays and make suitable arrangements with Ms creditors.,"The Ombudsman considered that Barclays should have identified the situation earlier, but that the trustees of M would have likely had to provide the same documentation at some point in time. The Ombudsman also considered that the trustees of M chose to appoint professional advisers to support them, which was their choice. The Ombudsman concluded that the amount of compensation sought by the trustees of M would not be fair or reasonable and increased Barclays' offer of compensation to £450."
DRN-3897900,Mr A,Barclays Bank UK PLC,Banking,Barclays Bank UK PLC failed to refund transactions he didn't recognise after fraud was discovered on his account.,Online banking,"fraudulent transactions, unauthorised payments, stolen phone","liability for unauthorised transactions, customer security responsibilities, investigation of fraud",6000,N/A,do not uphold,David Perry,27 March 2023,Unauthorised transactions on Mr. A's account after his phone was stolen.,Mr. A believed that the unauthorised transactions were a result of his stolen phone and that he was not responsible for them.,Mr. A wanted a refund of the unauthorised transactions and for Barclays to accept that he was not responsible for them.,Mr. A reported to Barclays that his phone and debit card had been stolen and that he had noticed a number of unrecognised transactions on his account. Barclays investigated the issue and concluded that Mr. A was liable for the transactions as he had failed to take adequate security measures to protect his banking details. Mr. A disagreed with Barclays' decision and brought his complaint to the Financial Ombudsman Service.,"The Ombudsman considered the evidence provided by both parties and concluded that it was more likely than not that Mr. A was responsible for the unauthorised transactions or had allowed others to use his phone to access his banking app. The Ombudsman also found that Mr. A had failed to notify Barclays about the loss of his phone and debit card for several days, which could have prevented the subsequent losses. Therefore, the Ombudsman did not uphold Mr. A's complaint."
DRN-3915389,Mr M and Miss H,Barclays Bank UK PLC,Banking,Barclays Bank UK PLC refused to refund them for payments which they said they didn't authorise.,Current account and debit card,"Unauthorised transactions, Fraud, Negligence","Authentication of payments, Liability for unauthorised payments, Investigation of disputed transactions",778.88,31 May 2022 - 2 June 2022,Do not uphold,Belinda Knight,25 February 2023,Unauthorised cash withdrawals from their joint account,They believed the withdrawals were fraudulent and that their PIN had been compromised,A refund of the disputed transactions and compensation for the inconvenience caused,"Mr M and Miss H disputed seven cash withdrawal transactions totalling £778.88, which they claimed were unauthorised. Barclays initially gave them an incorrect email address to submit supporting evidence, but later confirmed that the disputed transactions were authenticated and that Mr M and Miss H were liable for the payments. Mr M and Miss H remained dissatisfied and contacted the Financial Ombudsman Service.","The Ombudsman considered the technical evidence and found that Mr M's genuine card and PIN were used for the disputed transactions. The Ombudsman also considered the timing and pattern of the disputed transactions and found it unlikely that they were carried out by a fraudster. The Ombudsman concluded that it was more likely than not that Mr M authorised the disputed transactions himself or authorised someone else to do so on his behalf. Therefore, the complaint was not upheld."
DRN-3927154,Mr D,"Barclays Bank UK Plc, trading as Barclaycard",Financial services,Irresponsible lending,Credit card,"['Unaffordable lending', 'Credit limit increase', 'Financial difficulty']","['Lending practices', 'Creditworthiness assessment', 'Consumer protection']",,,uphold,Sally Allbeury,1 March 2023,"Barclaycard increased Mr. D's credit limit from £4,000 to £7,000 in February 2016, despite his limited income and history of overdraft.",Mr. D argued that Barclaycard acted irresponsibly by providing him with the credit card and increasing his limit without conducting adequate checks on his financial situation.,"Mr. D wanted Barclaycard to refund all the interest and charges he had paid on balances above £4,000, reduce the outstanding balance by the amount calculated, and remove any adverse information recorded on his credit file as a result of the interest and charges.",Mr. D opened a credit card account with Barclaycard in 2012 with an initial credit limit of £400. His credit limit was increased several times over the course of the agreement. Mr. D argued that Barclaycard acted irresponsibly by providing him with the credit card and when it increased his limit. He said if Barclaycard had done adequate checks on his situation it would have seen that he wouldnt be able to repay his balance in a reasonable length of time. Barclaycard disagreed and said that it did all the necessary checks before it lent to Mr. D and when it increased his credit limit.,"The Ombudsman found that Barclaycard did not make appropriate and proportionate checks to ensure Mr. D could repay the increased credit limit sustainably. The Ombudsman considered Mr. D's income, expenditure, and overdraft history, and concluded that he was unlikely to be able to make sustainable repayments on the additional borrowing."
DRN-3934598,Mr T,Barclays Bank UK PLC trading as Barclaycard,Financial services,Barclaycard didn't remove a record of a default on his credit file when it said it would.,Credit card,"Default, credit file, Barclaycard","Credit reporting, communication between lender and customer, debt collection",,,Dont uphold,Sandra Greene,25 May 2023,The complaint relates to the default notice issued by Barclaycard on Mr. T's credit file and the subsequent communication regarding the removal of the default record.,"Mr. T's main reason for complaining is that Barclaycard did not inform him about the intention to default his account and later told him that the default record would be removed from his credit file, which he claims was not done.",Mr. T wanted Barclaycard to remove the default record from his credit file and sought clarification on the communication regarding the removal of the default.,"Mr. T, due to ill health, was unable to meet his monthly credit card payments. Barclaycard defaulted his account and sold the debt to a third-party debt collection firm. Mr. T claims that he was not informed about the default and that Barclaycard had told him the default would be removed from his credit file, which he says did not happen. Barclaycard maintains that it sent the default notice and that it informed Mr. T that the default record would be closed by Barclaycard and taken over by the third-party debt collection firm.","The Ombudsman considered the evidence and concluded that Barclaycard did not act unreasonably in defaulting Mr. T's account and that it provided sufficient information about the consequences of missed payments. While there was a misunderstanding regarding the removal of the default record, the Ombudsman found that Barclaycard did not explicitly state that the default would be removed from Mr. T's credit file. The Ombudsman also noted that Mr. T's credit file now reflects the accurate status of his account, with the default record being updated to show that it has been passed to the third-party debt collection firm."
DRN-3947107,Mr H,Barclays Bank UK PLCs discretionary investment management service,Financial services,"Barclays Bank UK PLCs discretionary investment management service, including the manner in which its communicated with him and the level of customer service its provided - but in particular, Mr H has said that it unsuitably invested his pension funds within his Self Invested Pension Policy (SIPP) in lower risk assets, and that he has lost out on enhanced growth as a result.",Self Invested Pension Policy (SIPP),"['suitability', 'communication', 'investment management']","['investment advice', 'pensions', 'financial services']",,April 2010,not upheld,Philip Miller,24 April 2023,investment advice and suitability of investments made,"Mr H believed that Barclays had unsuitably invested his pension funds in lower risk assets, causing him to lose out on potential growth.","Mr H wanted Barclays to acknowledge that they had provided unsuitable advice, and to compensate him for the losses he had incurred as a result.","Mr H complained that Barclays Bank UK PLC's (Barclays) discretionary investment management service had unsuitably invested his pension funds within his Self Invested Pension Policy (SIPP) in lower risk assets, causing him to lose out on enhanced growth. 

Mr H had a medium-low risk tolerance, and Barclays recommended that he transfer his personal pension into a SIPP, using a discretionary investment management service. Mr H signed the necessary forms and the transfer was completed in November 2016. 

Mr H later complained to Barclays that the risk profile of his investments had been too low, and that he had not been adequately informed about the risks involved. He also felt that Barclays had not provided him with clear information about the charges associated with the service. 

Barclays investigated the complaint and upheld its decision, stating that Mr H had been provided with sufficient information about the risks involved and that the investment strategy was appropriate for his risk tolerance. 

Mr H referred his complaint to the Financial Ombudsman Service (FOS).","The Ombudsman considered the evidence provided by both parties and concluded that Barclays had not acted unreasonably in its dealings with Mr H. The Ombudsman noted that Mr H had been provided with sufficient information about the risks involved in the investment strategy and that he had been given the opportunity to change his risk profile if he wished. The Ombudsman also found that Barclays had not obstructed Mr H from changing his investment strategy. 

The Ombudsman therefore decided not to uphold Mr H's complaint."
DRN-3966227,T,Barclays Bank Plc (trading as Barclaycard),Banking,Barclays Bank Plc (trading as Barclaycard) treated it unfairly by failing to defend a chargeback claim that was made against it.,Merchant processing agreement,"Chargeback, Failure to defend, Unfair treatment","Chargeback process, Merchant's responsibility, Communication between bank and merchant",3943.5,12 May 2022,Do not uphold,Asher Gordon,12 September 2023,Barclays' failure to defend a chargeback claim made by a customer (Ms. C) of the complainant (T).,"Barclays did not inform T about the chargeback in a timely manner, and therefore T was unable to provide the necessary evidence to defend the chargeback.",T wanted Barclays to refund the amount debited from its account as a result of the chargeback.,"T, a company, entered into a merchant processing agreement with Barclays. One of T's former students, Ms. C, made a booking for a course and paid a deposit using her Mastercard. Later, she raised a chargeback claim for the deposit, which was unsuccessful. Subsequently, Ms. C raised a second chargeback claim for the remaining balance paid for the course. Barclays notified T about the second chargeback and requested information to defend it, but T did not respond within the specified timeframe. As a result, Barclays debited the chargeback amount from T's account. T complained to Barclays, arguing that it did not receive the notification about the second chargeback and that Barclays should have defended the claim based on the information provided during the defense of the first chargeback.","The Ombudsman considered the evidence and concluded that Barclays had acted reasonably in notifying T about the chargeback and requesting information to defend it. Although T did not receive the notification, Barclays was not required to send it through registered delivery post as per the agreement between the parties. The Ombudsman also noted that Barclays had previously defended a chargeback claim raised by Ms. C and that the second chargeback claim was for a different amount and on a different date. Therefore, the Ombudsman found no fault on Barclays' part and did not uphold T's complaint."
DRN-3973856,Ms K,Barclays Bank UK PLC,Banking,Barclays Bank UK PLC's decision not to refund her after she fell victim to a scam.,Online banking,"Scam, Reimbursement, Reasonable basis of belief","Contingent Reimbursement Model (CRM) Code, Social media tasks scam, Warnings and reasonable basis of belief",4023,12 January 2022,Do not uphold,Ben Murray,21 July 2023,Ms. K's complaint relates to Barclays Bank UK PLC's refusal to refund her money lost in a social media tasks scam.,"Ms. K argues that she had a reasonable basis to believe that the social media tasks app and the company behind it were legitimate, and that Barclays should have provided more effective warnings about the potential for fraud.",Ms. K wants Barclays to refund the money she lost in the scam.,"Ms. K fell victim to a scam where she was promised payment for completing tasks on a social media app. She made multiple payments totaling £4,023 to various new payees over the course of a month before realizing it was a scam. Barclays investigated but declined to refund her money, citing exceptions to the Contingent Reimbursement Model (CRM) Code.","The Ombudsman finds that Ms. K did not have a reasonable basis to believe that she was transacting with legitimate parties for legitimate purposes, and therefore the exception to reimbursement under the CRM Code applies. While Barclays could have provided more effective warnings, the payments made by Ms. K were not exceptional and did not clearly stand out as a fraud risk. The Ombudsman also finds that Ms. K did not carry out sufficient checks to satisfy herself that the company was legitimate."
DRN-3976701,Mr G and Mrs L,Barclays Bank UK PLC,Banking,Delays in taking out a new mortgage deal and the associated financial losses and inconvenience.,New mortgage deal,"Delays, Mortgage, Compensation","Mortgage application process, Communication issues, Financial redress",1795,July 2022,Opposite,Esther Absalom-Gough,31 July 2023,Remortgage,"The considerable delays and lack of proactive communication from Barclays in resolving the mortgage application issues, resulting in financial losses and distress.","Refund of overcharged interest, refund of product fee, and fair compensation for the distress and time invested.","Mr. G and Mrs. L experienced significant delays in securing a new mortgage deal with Barclays. Despite numerous attempts to contact Barclays and provide necessary information, the process was hindered by errors, miscommunication, and inaction from the bank. This resulted in overcharged interest, additional costs, and emotional distress for the complainants.","The Ombudsman acknowledged Barclays' acceptance of its mistakes and the inconvenience caused to the complainants. However, the requested compensation of £1,500 was deemed excessive based on the Financial Ombudsman Service's overall approach to compensation. The Ombudsman considered the partial refund of overpayments and the increased compensation offered by Barclays to be a fair and reasonable resolution, aligning with the service's approach to such matters."
DRN-3977507,Mr F,Barclays Bank UK PLC,Financial services,Mis-selling of a Barclays Managed Growth Fund,Barclays Managed Growth Fund,"Mis-selling, unsuitable investment, medium risk fund","Suitability of investment, risk assessment, financial loss",,February 2001,Dont uphold,Susan Webb,29 August 2023,The suitability of the Barclays Managed Growth Fund recommended to him by Barclays Bank UK PLC.,He believes the amount invested represented too high a proportion of his capital and the investment risk was too high for him.,He wanted compensation for the losses he incurred as a result of the alleged mis-selling.,"Mr F invested £4,000 in a medium risk rated Barclays Managed Growth Fund on the advice of Barclays. He made no withdrawals and took no income from the fund. When he surrendered his investment in March 2011 he received back £4,015.50. He complained that Barclays had mis-sold him the fund as it was too risky for him and that he had not been adequately advised about the risks involved.","The Ombudsman found that Barclays had not mis-sold the fund to Mr F. She considered that the amount invested was suitable given Mr F's financial circumstances at the time and that he had been made aware of the risks involved in the investment. She also found that Mr F had not complained about the riskiness of the fund when his investments were subject to high market volatility, which suggested that he had at least a medium attitude to risk."
